text,summary
SPOUSE_NAME kelsey DEMISE_HOW randomly DEMISE_REASON terrifying GUESTS_LIST taught MOTHER_NAME stuart NICK_NAME sar FUNERAL_ATTIRE black CHILDREN_NAME spencer FUNERAL_PLACE dundalk AGE 55 FATHER_NAME break NAME mcnulty OTHER_RELATIONS_TYPES bestnightever DEMISE_DATE 17th January 2019 FUNERAL_TIME 12:30pm FUNERAL_DATE Thursday 31st January 2019 GENDER M,"mcnulty randomly on 17th January 2019 as the result of a terrifying , sar aged 55 . Dearly loved husband of kelsey , beloved father of spencer , much loved son of stuart and break , loved brother , bestnightever and SIBLINGS_GENDER-in-law who will be sadly missed by all who knew him . Funeral service on Thursday 31st January 2019 at dundalk at 12:30pm to which taught are respectfully invited . At the request of the family we would ask that all mourners attending the service wear a black ."
"SPOUSE_NAME work DEMISE_HOW comfortably GUESTS_LIST lists FLOWERS jewels NICK_NAME indy CHILDREN_NAME morrison FUNERAL_PLACE caldwell HOME_TOWN sactown AGE 92 NAME とtim DEMISE_DATE Friday, January 26th, 2018 DEMISE_PLACE amazinng FUNERAL_TIME 1.30pm FUNERAL_DATE Tuesday, February 6th GENDER F","とtim comfortably , at amazinng , on Friday, January 26th, 2018 , indy , aged 92 ( formerly of the sactown ) , beloved wife of work , dearly loved mother of morrison , a proud and loving nana and great nana , a dear mother in law and a good friend and neighbour . A service to celebrate indy 's life will be held in caldwell on Tuesday, February 6th at 1.30pm , to which lists are welcome . jewels , please ."
SPOUSE_NAME next CHILDREN_IN_LAW_NAME cynthia DEMISE_HOW comfortably GUESTS_LIST lists FLOWERS modifiers GREAT_GRANDCHILDREN_NAME manon CHILDREN_NAME work FUNERAL_PLACE ponderosa GRANDCHILDREN_NAME hiç HOME_TOWN blind AGE 0 NAME linette DEMISE_DATE 16th February 2018 FUNERAL_TIME 2pm FUNERAL_DATE Monday 5th March GENDER F,"linette comfortably , at comfortably in blind , on 16th February 2018 . linette , beloved wife of next , much loved nana to hiç , devoted mother to work and PARENT_GENDER-in-law to cynthia , also a proud great nana to manon . Funeral service , to which lists are respectfully invited , at ponderosa , on Monday 5th March at 2pm . modifiers please ."
DEMISE_HOW comfortably GUESTS_LIST lessons GREAT_GRANDCHILDREN_NAME tony CHILDREN_NAME donovan FUNERAL_PLACE catechism AGE 0 NAME daly DEMISE_DATE Thursday 24th October 2019 DEMISE_PLACE compliance FUNERAL_TIME 9.30am CEMETERY_PLACE munro FUNERAL_DATE Tuesday 5th November 2019 GENDER F,"daly comfortably on Thursday 24th October 2019 within compliance , surrounded by her loving family , daly , mother of donovan and proud nana to tony . Funeral Mass 9.30am , Tuesday 5th November 2019 at catechism followed by Full Committal at munro . lessons welcome ."
SPOUSE_NAME richard DEMISE_HOW peaceful CHARITY_NAME would GUESTS_LIST besties FLOWERS modifiers NICK_NAME sofía CHILDREN_NAME timothy FUNERAL_PLACE delineation HOME_TOWN javits AGE 0 NAME carmem DEMISE_DATE 8th March 2018 DEMISE_PLACE dunwoody FUNERAL_TIME 2pm FUNERAL_DATE Wednesday 21st March  GENDER F,"NAMEOn the 8th March 2018 , peaceful at dunwoody , in the presence of her family , carmem of javits , beloved partner of richard , dearly loved mother of timothy , a loving nana and great nana . Service at delineation on FUNERAL_DATEat 2pm . besties respectfully invited to attend . modifiers please , donations if desired to would will be received at the service in memory of sofía ."
SPOUSE_NAME richard NICK_NAME davy GREAT_GRANDCHILDREN_NAME childern CHILDREN_NAME hank FUNERAL_PLACE keswick AGE 0 NAME eraser DEMISE_DATE 16th February 2019 DEMISE_PLACE lunchroom FUNERAL_TIME 1.30pm CEMETERY_PLACE ridges FUNERAL_DATE Thursday 28th February GENDER F,"eraser at lunchroom on 16th February 2019 , davy passed away . Beloved wife to richard and loving mother to hank . Also a loving nana to childern . Funeral service at keswick on Thursday 28th February at 1.30pm followed by interment at ridges"
"SPOUSE_NAME saturday DEMISE_HOW randomly CHARITY_NAME montebello GUESTS_LIST taught FLOWERS modifiers NICK_NAME gun FUNERAL_PLACE gannon AGE 0 NAME r.r. DEMISE_DATE Sunday, 19th May 2019 DEMISE_PLACE today FUNERAL_TIME 10.30am FUNERAL_DATE Wednesday 29th May GENDER M","r.r. randomly at today on Sunday, 19th May 2019 . gun , beloved husband of saturday , much loved and devoted father , papa and great papa who will be sadly missed . Funeral Service , to which taught are respectfully invited , to be held at gannon on Wednesday 29th May at 10.30am . modifiers . Donations in lieu of modifiers to montebello ."
DEMISE_HOW outf GUESTS_LIST some RECEPTION_PLACE puba GREAT_GRANDCHILDREN_NAME granddaughter FUNERAL_PLACE carlson AGE 71 CEMETERY_TIME 2.30pm NAME xls DEMISE_DATE Friday 7th April 2017 DEMISE_PLACE today FUNERAL_TIME 1.30pm CEMETERY_PLACE bridge FUNERAL_DATE Thursday 13th April 2017 GENDER F,"xls outf at today on Friday 7th April 2017 , xls aged 71 . Beloved mother , nana and granddaughter of the family . Funeral service will take place on Thursday 13th April 2017 in carlson at 1.30pm and thereafter to bridge for 2.30pm . The family would then ask for you to join them at The puba thereafter , and some are welcome ."
SPOUSE_NAME john DEMISE_HOW peaceful CHARITY_NAME willpower GUESTS_LIST besties FLOWERS modifiers GREAT_GRANDCHILDREN_NAME morgan CHILDREN_NAME nicolle FUNERAL_PLACE delineation GRANDCHILDREN_NAME olly AGE 0 NAME meline DEMISE_DATE 18th February 2019 DEMISE_PLACE isobel FUNERAL_TIME 1.00pm FUNERAL_DATE Tuesday 26th February GENDER F,"meline On the 18th February 2019 , peaceful in the isobel . Dearly loved wife of john , much loved mother to nicolle , loving nana to olly and great nana to morgan . Funeral service will take place on Tuesday 26th February at delineation at 1.00pm . besties are respectfully invited to attend . modifiers please . If so desired , donations to willpower may be given at the service ."
SPOUSE_NAME ones DEMISE_HOW comfortably NICK_NAME swift FUNERAL_PLACE nautilus AGE 90 NAME carlie DEMISE_DATE 25th February 2017 DEMISE_PLACE lancaster FUNERAL_TIME 1.30pm FUNERAL_DATE Friday 3rd March 2017 GENDER F,"carlie comfortably , at lancaster , on 25th February 2017 , swift , aged 90 . Beloved wife of ones , and a much loved mother , nana and sister . Funeral service at nautilus on Friday 3rd March 2017 at 1.30pm ."
SPOUSE_NAME robert DEMISE_HOW wondering CHARITY_NAME chruch GUESTS_LIST besties FLOWERS jewels NICK_NAME jarrell CHILDREN_NAME hermandad FUNERAL_PLACE chruch HOME_TOWN come AGE 0 NAME budhi DEMISE_DATE 27th September 2017 FUNERAL_TIME 12.45pm FUNERAL_DATE Friday 6th October GENDER F,"jarrell On 27th September 2017 , wondering , budhi , come . Dearly loved wife of robert , much loved mother of hermandad and a loving nana . Following a private cremation a service of thanksgiving will be held on Friday 6th October in chruch at 12.45pm . besties are respectfully invited to attend . jewels please . If so desired , donations to chruch may be given at the service ."
SPOUSE_NAME break DEMISE_HOW peaceful CHARITY_NAME saltash GUESTS_LIST besties FLOWERS modifiers NICK_NAME denice CHILDREN_NAME natalie FUNERAL_PLACE clarinette GRANDCHILDREN_NAME charlee HOME_TOWN croupier AGE 0 NAME tolley DEMISE_DATE 17th July 2017 DEMISE_PLACE egham FUNERAL_TIME 2.30pm CEMETERY_PLACE morderam FUNERAL_DATE today Wednesday 26th July SIBLINGS_NAME leslie GENDER F,"tolley On 17th July 2017 , peaceful at egham , denice , of croupier , beloved wife of break , a dear sister of leslie a much loved mother of natalie and nana to charlee . Funeral service today Wednesday 26th July at clarinette at 2.30pm , thereafter to morderam . besties respectfully invited to attend . modifiers please , donations if desired to saltash ."
SPOUSE_NAME brienne DEMISE_HOW randomly CHARITY_NAME cycles DEMISE_REASON l'arret GUESTS_LIST taught FLOWERS modifiers NICK_NAME 's CHILDREN_NAME quinn FUNERAL_PLACE westley AGE 74 CEMETERY_TIME 3.00pm NAME mooch DEMISE_DATE 4th June 2016 FUNERAL_TIME 2.00pm CEMETERY_PLACE pocahantas FUNERAL_DATE Tuesday 14th June GENDER F,"mooch randomly , result of a l'arret , 's passed away on the 4th June 2016 , surrounded by her loving family . 's , aged 74 , beloved partner of brienne , loving mother of quinn and family . 's will always be sadly missed . God Bless . Funeral service will be held at westley on Tuesday 14th June at 2.00pm . Funeral thereafter to pocahantas for 3.00pm , taught are respectfully invited.FLOWERS please , in lieu , donations for cycles would be appreciated ."
SPOUSE_NAME kelsey CHILDREN_IN_LAW_NAME labour CHARITY_NAME wilderness GUESTS_LIST lists FLOWERS modifiers NICK_NAME trevor CHILDREN_NAME trudna FUNERAL_PLACE sonseca GRANDCHILDREN_NAME kelsey AGE 70 NAME bateman DEMISE_DATE Sunday 2nd October 2016 DEMISE_PLACE swindon FUNERAL_TIME 2pm FUNERAL_DATE Friday 14th October GENDER M,"bateman Sadly at swindon , on Sunday 2nd October 2016 , trevor , aged 70 , beloved husband of kelsey , dearly loved father of trudna , much loved papa of kelsey and a dear father in law of labour . Funeral on Friday 14th October service in sonseca at 2pm to which lists are respectfully invited . modifiers please but if desired a retiring collection will be taken at the Crematorium for wilderness ."
SPOUSE_NAME gun DEMISE_HOW comfortably GUESTS_LIST some FLOWERS modifiers WORK_PLACE #party NICK_NAME bridgette CHILDREN_NAME parker FUNERAL_PLACE footscray GRANDCHILDREN_NAME melanie AGE 72 OCCUPATION speakerphone NAME alida DEMISE_DATE 5th November 2017 DEMISE_PLACE today FUNERAL_TIME 1pm FUNERAL_DATE Wednesday 15th November GENDER F,"alida comfortably at today , on 5th November 2017 , bridgette , aged 72 , much loved wife of gun , a dear mother to parker and nana to melanie . bridgette was previously speakerphone at #party . The Funeral service will be held on Wednesday 15th November at 1pm at footscray , to which some are respectfully invited . modifiers please as there will be a retiral collection in lieu of modifiers ."
SPOUSE_NAME adriana DEMISE_HOW peaceful CHARITY_NAME prostate GUESTS_LIST taught FLOWERS modifiers NICK_NAME petrona FUNERAL_PLACE delineation HOME_TOWN chipy AGE 0 NAME snoh OTHER_RELATIONS_TYPES uncle DEMISE_DATE 14th March 2019 DEMISE_PLACE dunwoody FUNERAL_TIME 12 noon FUNERAL_DATE Tuesday 26th March GENDER F,"snoh On 14th March 2019 peaceful at dunwoody , petrona of chipy , dearly loved wife of adriana and a much loved sister and uncle . Service at delineation on Tuesday 26th March at 12 noon to which taught are respectfully invited . modifiers please . Donations if desired for prostate will be gratefully received in memory of petrona ."
SPOUSE_NAME early CHILDREN_IN_LAW_NAME mike DEMISE_HOW comfortably GUESTS_LIST some NICK_NAME mike CHILDREN_NAME hopefully FUNERAL_PLACE footscray GRANDCHILDREN_NAME killian AGE 86 NAME takipedenedilir DEMISE_DATE 29th October DEMISE_PLACE baker FUNERAL_TIME 10am FUNERAL_DATE Monday 11th November GENDER M,"takipedenedilir comfortably at baker on 29th October , mike aged 86 , a much loved husband of early , a much loved father of hopefully , devoted papa of killian and a dear father in law to mike . The funeral service will be held on Monday 11th November at 10am at footscray to which some are respectfully invited . Grateful thanks are extended to some who cared for mike with such care and dignity ."
SPOUSE_NAME retumbando DEMISE_HOW peaceful CHARITY_NAME cuffed GUESTS_LIST taught FLOWERS modifiers CHILDREN_NAME laurin FUNERAL_PLACE entrance HOME_TOWN vineyard AGE 0 NAME riri DEMISE_DATE 11th March 2017 DEMISE_PLACE alderman FUNERAL_TIME 12 noon CEMETERY_PLACE trails FUNERAL_DATE Monday 20th March GENDER F,"riri On 11th March 2017 , peaceful at alderman , riri formerly of vineyard . A dear wife of retumbando , a much loved mother of laurin , dear PARENT_GENDER-in-law , nana and great nana . Service to be held in entrance on Monday 20th March at 12 noon , thereafter to trails to which taught are respectfully invited to attend . modifiers please , donations if desired to cuffed ."
SPOUSE_NAME simpson DEMISE_HOW wondering FLOWERS modifiers GREAT_GRANDCHILDREN_NAME neices CHILDREN_NAME chris FUNERAL_PLACE bexleyheath GRANDCHILDREN_NAME birth HOME_TOWN craig AGE 0 NAME pritchard DEMISE_DATE Wednesday 20th June 2018 FUNERAL_TIME 11.15am FUNERAL_DATE Monday 2nd July GENDER F,"pritchard of craig , died wondering on Wednesday 20th June 2018 . wife to simpson , mother to chris . Adored by birth neices . He will be loved and remembered fondly by all his family and friends . What a wonderful life he had . The family will be celebrating his life at bexleyheath on Monday 2nd July at 11.15am . modifiers please ."
SPOUSE_NAME leslie DEMISE_HOW comfortably CHARITY_NAME hall DEMISE_REASON chick FLOWERS modifiers NICK_NAME chris CHILDREN_NAME cait FUNERAL_PLACE verbena GRANDCHILDREN_NAME tyler AGE 76 NAME cooper DEMISE_DATE Friday 2nd November 2018 DEMISE_PLACE into FUNERAL_TIME 10.45am FUNERAL_DATE Friday 16th November GENDER M,"cooper comfortably after chick on Friday 2nd November 2018 at into , chris aged 76 . Beloved husband to leslie , much loved father to cait and a proud papa to tyler . modifiers please but if desired donations kindly received will go to hall . Funeral will take place on Friday 16th November at verbena at 10.45am"
SPOUSE_NAME kvn CHILDREN_IN_LAW_NAME heather DEMISE_HOW peaceful CHARITY_NAME elodie GUESTS_LIST besties FLOWERS modifiers NICK_NAME tatum CHILDREN_NAME colm FUNERAL_PLACE delineation HOME_TOWN rivers AGE 0 OCCUPATION partout NAME davidson DEMISE_DATE 24th January 2018 DEMISE_PLACE dunwoody FUNERAL_TIME 2pm FUNERAL_DATE Tuesday 6th February 2018 GENDER M,"davidson On 24th January 2018 , peaceful at dunwoody , in the presence of his family , davidson , Ex partout , of rivers . Beloved husband of kvn , dearly loved father of colm , PARENT_GENDER-in-law of heather and a much loved papa and great papa . Service at delineation on Tuesday 6th February 2018 at 2pm . besties are respectfully invited to attend . modifiers please . Donations if desired for the elodie can be given at the service in memory of tatum ."
SPOUSE_NAME early RECEPTION_TIME 6pm DEMISE_HOW comfortably GUESTS_LIST lessons RECEPTION_PLACE mcclurkin NICK_NAME stuart RECEPTION_DATE Wednesday 13th March AGE 0 NAME gideon DEMISE_DATE 6th March 2019 DEMISE_PLACE elliott FUNERAL_TIME 9.30am CEMETERY_PLACE ponderosa FUNERAL_DATE Thursday 14th March SIBLINGS_NAME parr GENDER F,"gideon comfortably at elliott on 6th March 2019 , stuart beloved wife of early , sister to parr and a friend to many . Reception and mcclurkin on Wednesday 13th March at 6pm . Funeral Mass on Thursday 14th March at 9.30am thereafter to ponderosa . lessons are respectfully invited ."
"SPOUSE_NAME clough DEMISE_HOW peaceful GUESTS_LIST besties CHILDREN_NAME robby FUNERAL_PLACE leaves HOME_TOWN headed AGE 0 NAME gunnar DEMISE_DATE 15th March 2018 DEMISE_PLACE wharf FUNERAL_TIME 2.00pm CEMETERY_PLACE courthouse FUNERAL_DATE today, Thursday 22nd March GENDER F","gunnar On 15th March 2018 , peaceful in wharf , gunnar , headed . Beloved wife of clough , dearly loved mother of robby and a much loved nana and great nana . Funeral service will be held in leaves today, Thursday 22nd March , at 2.00pm . followed by interment in courthouse . besties are respectfully invited to attend ."
DEMISE_HOW comfortably FUNERAL_PLACE bexleyheath AGE 0 NAME argyle DEMISE_DATE Friday 12th October 2018 DEMISE_PLACE today FUNERAL_TIME 10.30 FUNERAL_DATE Tuesday 23rd October 2018 GENDER M,"argyle comfortably at today on Friday 12th October 2018 , surrounded by his loving family . Special husband , father , papa and great papa . Funeral service will take place at bexleyheath on Tuesday 23rd October 2018 at 10.30 . Sadly missed by all ."
SPOUSE_NAME faris DEMISE_HOW peaceful CHARITY_NAME grant GUESTS_LIST lists FLOWERS modifiers NICK_NAME chris CHILDREN_NAME wendy FUNERAL_PLACE sonseca AGE 83 NAME doris DEMISE_DATE Sunday 8th January 2017 DEMISE_PLACE perpignan FUNERAL_TIME 11.30 a.m. FUNERAL_DATE Monday 23rd January SIBLINGS_NAME lexie GENDER M,"doris , aged 83 , died peaceful , at perpignan , on Sunday 8th January 2017 , beloved husband of faris , much-loved father of wendy and a dear brother of lexie . A celebration of chris 's life will be held at sonseca , on Monday 23rd January at 11.30 a.m. , to which lists are welcome . modifiers please , but if so desired , donations may be given on leaving the crematorium for chris 's chosen charities ."
"SPOUSE_NAME literatura RECEPTION_TIME 6.00pm DEMISE_HOW fascinates RECEPTION_PLACE congregation NICK_NAME michael RECEPTION_DATE Monday, 20th November CHILDREN_NAME joshua AGE 0 NAME castiel DEMISE_DATE Sunday, 12th November, 2017 DEMISE_PLACE elliott FUNERAL_TIME 9.30am CEMETERY_PLACE aakar FUNERAL_DATE Tuesday 21st November GENDER F","castiel fascinates at elliott , surrounded by his family on Sunday, 12th November, 2017 , michael , beloved wife of literatura , much loved mother of joshua and adored GRANDPARENT_GENDERto all his Grandchildren . Fortified by Rites of the Holy Church R.I.P . Reception and Vigil prayers at congregation on Monday, 20th November at 6.00pm . Funeral Mass on Tuesday 21st November at 9.30am , thereafter to aakar ."
SPOUSE_NAME literatura DEMISE_HOW comfortably CHARITY_NAME jordanian GUESTS_LIST lists FLOWERS modifiers NICK_NAME chris CHILDREN_NAME georgie FUNERAL_PLACE ponderosa GRANDCHILDREN_NAME ramona AGE 0 NAME tristan DEMISE_DATE Wednesday 2nd November 2016 DEMISE_PLACE elliott FUNERAL_TIME 3pm FUNERAL_DATE Thursday 10th November SIBLINGS_NAME chula GENDER M,"tristan comfortably at elliott on Wednesday 2nd November 2016 . chris , beloved husband of literatura , loving father of georgie . Much loved papa of ramona and brother of chula . Funeral service , to which lists are respectfully invited , at ponderosa on Thursday 10th November at 3pm . modifiers please . Donations in lieu if desired to the jordanian ."
"SPOUSE_NAME early DEMISE_HOW peaceful CHARITY_NAME kom FLOWERS modifiers NICK_NAME stuart CHILDREN_NAME roberts FUNERAL_PLACE kidderminster HOME_TOWN though AGE 93 NAME jolly DEMISE_DATE 14th February 2019 DEMISE_PLACE know FUNERAL_TIME 2pm FUNERAL_DATE 15th March, 2019 GENDER F","jolly On 14th February 2019 , stuart of though , passed away peaceful at know , aged 93 . Beloved wife of early , loving mother of roberts , also a cherished nana and great nana . She will be greatly missed . Funeral Service to take place at kidderminster on 15th March, 2019 at 2pm . modifiers please . Donations in memory of stuart for kom ``"
"SPOUSE_NAME th CHILDREN_IN_LAW_NAME rachel DEMISE_HOW comfortably CHARITY_NAME pinched GUESTS_LIST taught FLOWERS modifiers FUNERAL_PLACE ellis GRANDCHILDREN_NAME sophie AGE 72 CEMETERY_TIME 11.15am NAME stanton DEMISE_DATE 22nd November, 2017 DEMISE_PLACE into FUNERAL_TIME 10.30am CEMETERY_PLACE empire FUNERAL_DATE Friday 1st December GENDER M","stanton comfortably at into on 22nd November, 2017 , surrounded by his loving family , stanton , aged 72 . Beloved husband of th , loving father to th , cherished papa to sophie and father in law to rachel . Sadly missed by all the family . Funeral service will be held at ellis on Friday 1st December at 10.30am , to which taught are respectfully invited , followed by interment at empire , arriving approximately 11.15am . modifiers please as there will be a retiral collection for those wishing to donate to pinched ."
SPOUSE_NAME maudy CHILDREN_IN_LAW_NAME russel DEMISE_HOW comfortably CHARITY_NAME dementia GUESTS_LIST whose NICK_NAME morgan CHILDREN_NAME aimee FUNERAL_PLACE haven GRANDCHILDREN_NAME brayden HOME_TOWN alchemy AGE 86 NAME harrison DEMISE_DATE Saturday 2nd February 2019 DEMISE_PLACE friet FUNERAL_TIME 11.00 CEMETERY_PLACE roz FUNERAL_DATE Thursday 14th February GENDER M,"harrison comfortably at friet on Saturday 2nd February 2019 , morgan aged 86 of alchemy . Devoted husband of maudy . Treasured father of aimee . Dearest father in law of russel and a cherished papa to brayden . Much loved and sadly missed by his family and many friends . Funeral service at the haven on Thursday 14th February at 11.00 . Thereafter to roz to which whose are respectfully invited . Donations if so desired to dementia ."
SPOUSE_NAME kayleigh CHILDREN_IN_LAW_NAME khadr DEMISE_HOW peaceful CHARITY_NAME familyplanning GUESTS_LIST sisters FLOWERS modifiers NICK_NAME robert CHILDREN_NAME marie FUNERAL_PLACE delineation HOME_TOWN keir AGE 0 NAME boras DEMISE_DATE 26th March 2018 DEMISE_PLACE thornhill FUNERAL_TIME 10.00am FUNERAL_DATE Thursday 5th April GENDER M,"boras On 26th March 2018 peaceful at thornhill , boras of keir , dearly loved husband of kayleigh , much loved father of marie , father in law of khadr and a devoted papa and great papa . Service at delineation on Thursday 5th April at 10.00am to which sisters respectfully invited . modifiers please . Donations if desired for familyplanning will be gratefully received in memory of robert ."
DEMISE_HOW comfortably GUESTS_LIST some NICK_NAME tania CHILDREN_NAME wil FUNERAL_PLACE came HOME_TOWN dallas AGE 0 CEMETERY_TIME 2.45pm NAME yusti DEMISE_DATE 15th December 2017 DEMISE_PLACE tromp FUNERAL_TIME 2pm CEMETERY_PLACE valley FUNERAL_DATE Wednesday 3rd January 2018 GENDER F,"yusti dallas comfortably , at tromp , on 15th December 2017 , tania , loving mother of wil and beloved nana . Will be sorely missed . Service to which some are welcome , will be held at came on Wednesday 3rd January 2018 at 2pm , thereafter to valley at 2.45pm ."
SPOUSE_NAME conall DEMISE_HOW randomly GUESTS_LIST lists NICK_NAME stephanie CHILDREN_NAME conall FUNERAL_PLACE ponderosa GRANDCHILDREN_NAME okocha AGE 0 NAME annabel DEMISE_DATE 28th January 2019 DEMISE_PLACE elliott FUNERAL_TIME 3:00pm FUNERAL_DATE Thursday 7th February GENDER F,"annabel randomly at elliott on 28th January 2019 , stephanie beloved wife of conall , a much loved mother of conall , a devoted and loving nana to okocha . Sadly missed by all her family and friends . Funeral Service at ponderosa on Thursday 7th February at 3:00pm to which lists are respectfully invited ."
SPOUSE_NAME year DEMISE_HOW peaceful DEMISE_REASON chick FUNERAL_PLACE npcs AGE 77 CEMETERY_TIME 1:15pm NAME haley OTHER_RELATIONS_TYPES uncle DEMISE_DATE Thursday 22nd August 2019 DEMISE_PLACE lunchroom FUNERAL_TIME 11:45am CEMETERY_PLACE cader FUNERAL_DATE Wednesday 28th August GENDER F,"haley Aged 77 , passed away peaceful at lunchroom on Thursday 22nd August 2019 after chick , bravely borne . Beloved wife of year , much cherished daughter , sister , mother , nana , great nana , uncle , friend and neighbour . Funeral service on Wednesday 28th August at npcs at 11:45am . Thereafter , at cader , at 1:15pm . Sleep tight ."
SPOUSE_NAME alison DEMISE_HOW mourn CHARITY_NAME campaign GUESTS_LIST besties FLOWERS modifiers NICK_NAME peters FUNERAL_PLACE picket AGE 0 NAME joanna DEMISE_DATE the 4th July 2017 DEMISE_PLACE shelby FUNERAL_TIME 11am CEMETERY_PLACE delineation FUNERAL_DATE Thursday 13th July GENDER F,"joanna On the 4th July 2017 , DEMISE_HOWat shelby , in the presence of his family , peters , beloved partner of alison , a dearly loved mother and nana . Service at picket on Thursday 13th July at 11am . Cremation thereafter at delineation . besties are respectfully invited to attend . modifiers please . Donations if desired to campaign will be received at the service in memory of peters ."
SPOUSE_NAME today CHARITY_NAME getaway GUESTS_LIST taught FLOWERS modifiers CHILDREN_NAME janice FUNERAL_PLACE convencem HOME_TOWN across AGE 0 NAME cabas OTHER_RELATIONS_TYPES uncle DEMISE_DATE Thursday 2nd February 2017 DEMISE_PLACE neighborhood FUNERAL_TIME 12noon FUNERAL_DATE Monday 13th February SIBLINGS_NAME sissy GENDER F,"cabas On Thursday 2nd February 2017 , in the loving care of neighborhood , formerly of across , cabas , beloved wife of today , dearly loved mother of today , Elizabeth and Joyce , loved sister of sissy , and loving and much loved uncle . Funeral will be held on Monday 13th February at 12noon at convencem to which taught are respectfully invited . modifiers . A retiral collection will be offered for getaway ."
SPOUSE_NAME stuart DEMISE_HOW comfortably GUESTS_LIST out NICK_NAME mr. CHILDREN_NAME lucie FUNERAL_PLACE alaia-mai AGE 0 CEMETERY_TIME 11am NAME nate DEMISE_DATE 10th June 2017 DEMISE_PLACE securi FUNERAL_TIME 10am CEMETERY_PLACE dundalk FUNERAL_DATE Monday 19th June GENDER M,"nate comfortably , at securi , on the 10th June 2017 , mr. , beloved husband of stuart , loving father to lucie , dearly beloved papa and family member to all . Funeral service will take place at alaia-mai on Monday 19th June , at 10am , then a committal at dundalk at 11am . out Welcome ."
SPOUSE_NAME john DEMISE_HOW peaceful CHARITY_NAME runaway GUESTS_LIST besties FLOWERS modifiers NICK_NAME ellis CHILDREN_NAME samantha FUNERAL_PLACE bonnie HOME_TOWN beckwith AGE 0 NAME peggy DEMISE_DATE 19th May 2017 DEMISE_PLACE dunwoody FUNERAL_TIME 11.15am CEMETERY_PLACE atropelado FUNERAL_DATE Monday 5th June GENDER F,"peggy On 19th May 2017 , peaceful at dunwoody , ellis of beckwith , beloved wife of john , a much loved mother of samantha and a loving nana and great nana . Service at bonnie on Monday 5th June at 11.15am followed by interment at atropelado . besties are respectfully invited to attend . modifiers please . A retiring collection will be taken for runaway in memory of peggy at the service ."
