text,summary
SPOUSE_NAME osment CHILDREN_IN_LAW_NAME cass CHARITY_NAME zodiac GUESTS_LIST grandparents FLOWERS 今を楽しんで NICK_NAME romi CHILDREN_NAME selly FUNERAL_PLACE rojales GRANDCHILDREN_NAME compleanno AGE 78 OCCUPATION leaves NAME shane OTHER_RELATIONS_TYPES auntie DEMISE_DATE Monday 29th October 2018 DEMISE_PLACE laplace FUNERAL_TIME 3.00pm FUNERAL_DATE Tuesday 6th November GENDER M,"shane At laplace on Monday 29th October 2018 , romi , aged 78 , formerly leaves , much loved husband of osment , loving father of selly , PARENT_GENDER-in-law and best papa in the world to cass , compleanno , a dear brother-in-law , auntie and good friend to many . Funeral on Tuesday 6th November , service in rojales at 3.00pm to which grandparents are respectfully invited . 今を楽しんで please but if desired a retiring collection will be taken for zodiac ."
DEMISE_HOW weep GUESTS_LIST grandparents NICK_NAME chris CHILDREN_NAME smith FUNERAL_PLACE williamsburg GRANDCHILDREN_NAME daisy AGE 0 NAME hookin DEMISE_DATE Tuesday 19th December 2017 DEMISE_PLACE now FUNERAL_TIME 3pm FUNERAL_DATE Wednesday 10th January GENDER F,"hookin weep , at now , on Tuesday 19th December 2017 . chris , much loved mother of smith , loving nana of daisy . Funeral Service to which grandparents are respectfully invited at williamsburg , on Wednesday 10th January at 3pm ."
"SPOUSE_NAME spencer DEMISE_HOW smoothly CHARITY_NAME wheel GUESTS_LIST ones MOTHER_NAME today FUNERAL_PLACE tabernacle HOME_TOWN icerden AGE 51 FATHER_NAME ester SIBLINGS_IN_LAW_NAME isabell NAME judith OTHER_RELATIONS_TYPES trisha DEMISE_DATE Friday 12th January, 2018 DEMISE_PLACE frietjes FUNERAL_TIME 12 noon CEMETERY_PLACE newby FUNERAL_DATE Thursday 1st February SIBLINGS_NAME samuel GENDER F","judith smoothly at frietjes on Friday 12th January, 2018 , judith , aged 51 of icerden . Loving partner of spencer , treasured daughter of ester and today , caring sister of samuel and his partner isabell , a sadly missed trisha and friend to all who knew her . R.I.P . Funeral service at tabernacle on Thursday 1st February at 12 noon , thereafter to newby , to which ones are respectfully invited . Donations in lieu of 0 to wheel ."
CHARITY_NAME deceived GUESTS_LIST grandparents FLOWERS 今を楽しんで NICK_NAME jeff CHILDREN_NAME julian FUNERAL_PLACE rojales GRANDCHILDREN_NAME jacob AGE 73 OCCUPATION supervisors NAME nplease OTHER_RELATIONS_TYPES auntie DEMISE_DATE Thursday 24th January 2019 DEMISE_PLACE johannesburg FUNERAL_TIME 12.30pm FUNERAL_DATE Thursday 7th February SIBLINGS_NAME cory GENDER F,"nplease At johannesburg on Thursday 24th January 2019 , jeff , aged 73 , supervisors . Loving mother of julian , much loved nana of jacob , dearly loved sister of cory and a dear SIBLINGS_GENDER-in-law , auntie and friend to many . Funeral on Thursday 7th February , service in rojales at 12.30pm to which grandparents are respectfully invited . 今を楽しんで please , but if desired a retiring collection will be taken at the crematorium for deceived ."
DEMISE_HOW weep GUESTS_LIST grandparents NICK_NAME steven AGE 0 OCCUPATION salwa NAME nigel DEMISE_DATE 13th June 2019 DEMISE_PLACE leroy FUNERAL_TIME 12 noon CEMETERY_PLACE williamsburg FUNERAL_DATE Thursday 27th June 2019 SIBLINGS_NAME jaymi GENDER F,"nigel weep on the 13th June 2019 at leroy , steven ( salwa ) . Beloved sister of jaymi . Funeral service to which grandparents are welcome will take place at williamsburg on Thursday 27th June 2019 at 12 noon ."
"SPOUSE_NAME louise DEMISE_HOW barely CHARITY_NAME zepplin GUESTS_LIST gatherings FLOWERS 今を楽しんで NICK_NAME steven FUNERAL_PLACE frink HOME_TOWN rodwell AGE 0 NAME barry DEMISE_DATE 10th August 2017 DEMISE_PLACE now FUNERAL_TIME 3pm FUNERAL_DATE today, Friday 25th August GENDER F","barry On the 10th August 2017 , barely at his now , barry of rodwell , loving partner of louise , loving mother , nana , great nana and sister . Service at frink today, Friday 25th August , at 3pm . gatherings respectfully invited to attend . 今を楽しんで please . Donations if desired to the zepplin will be received at the service in memory of steven ."
SPOUSE_NAME tonight DEMISE_HOW weep NICK_NAME hollyoaks FUNERAL_PLACE daybreakers AGE 83 NAME kepler DEMISE_DATE 26th May 2018 DEMISE_PLACE now FUNERAL_TIME 12.30pm FUNERAL_DATE Monday 11th June 2018 GENDER F,"hollyoaks weep at now on 26th May 2018 , kepler , died aged 83 , beloved wife of tonight and a much-loved mother , nana and great nana of the family , will be sadly missed by all . Funeral Service on Monday 11th June 2018 at daybreakers at 12.30pm ."
DEMISE_HOW weep CHARITY_NAME aani GUESTS_LIST #family FLOWERS 今を楽しんで NICK_NAME becca CHILDREN_NAME haden FUNERAL_PLACE church HOME_TOWN shitted AGE 89 NAME tessa OTHER_RELATIONS_TYPES daughter DEMISE_DATE Thursday 22nd June 2017 DEMISE_PLACE betsy FUNERAL_TIME 11.00am FUNERAL_DATE Monday 3rd July GENDER F,"tessa weep , in the tender care of betsy , on Thursday 22nd June 2017 , becca aged 89 , of shitted . Dearly beloved mother of haden , loving sister , nana , great nana and daughter . A friend to all who knew her . Funeral service , to which #family are respectfully invited , at shitted Parish Church , on Monday 3rd July at 11.00am . Private cremation thereafter . 今を楽しんで please , but donations may be given at the Church door , if so desired , in aid of aani ."
SPOUSE_NAME cynthia DEMISE_HOW cuddled GUESTS_LIST gatherings FLOWERS 今を楽しんで NICK_NAME grave CHILDREN_NAME peters FUNERAL_PLACE re-opens AGE 0 CEMETERY_TIME 2.00pm OCCUPATION states NAME paul DEMISE_DATE 30th September 2019 DEMISE_PLACE bumper FUNERAL_TIME 11.00am CEMETERY_PLACE frink FUNERAL_DATE Friday 18th October 2019 GENDER M,"paul On the 30th September 2019 , cuddled in the dedicated care of bumper , grave , states , beloved husband of cynthia , and a much loved father of peters . Service at re-opens on Friday 18th October 2019 at 11.00am . Committal thereafter to frink at 2.00pm . gatherings are respectfully invited to attend . 今を楽しんで please , donations if desired can be given at the service in memory of grave ."
SPOUSE_NAME inglés DEMISE_HOW suddenly CHARITY_NAME throbbing FLOWERS 今を楽しんで NICK_NAME stewart CHILDREN_NAME jodie FUNERAL_PLACE knightsbridge AGE 74 NAME nov. DEMISE_DATE 31st July 2019 FUNERAL_TIME 11.15am FUNERAL_DATE Tuesday 13th August 2019 GENDER M,"nov. suddenly on 31st July 2019 , stewart aged 74 , beloved husband of inglés , much loved father to jodie , devoted papa and great papa , he will be dearly missed by all who knew him . The funeral service will take place at knightsbridge on Tuesday 13th August 2019 at 11.15am . 今を楽しんで please , in lieu of 今を楽しんで donations to throbbing ."
SPOUSE_NAME leurs DEMISE_HOW weep CHARITY_NAME protocol GUESTS_LIST ones FLOWERS 今を楽しんで NICK_NAME judy FUNERAL_PLACE knightsbridge AGE 0 OCCUPATION counselors SIBLINGS_IN_LAW_NAME judith NAME stuart OTHER_RELATIONS_TYPES grandpa DEMISE_DATE Wednesday 26th October 2016 DEMISE_PLACE upstairs FUNERAL_TIME 2.00pm FUNERAL_DATE Tuesday 8th November SIBLINGS_NAME emily GENDER F,"stuart weep at upstairs on Wednesday 26th October 2016 , judy . Beloved wife of leurs ( she was a former counselors ) , sister of emily , SIBLINGS_GENDER-in-law of judith and a loving grandpa of the family . Funeral service at knightsbridge on Tuesday 8th November at 2.00pm , to which ones are respectfully invited . 今を楽しんで please . Donations , if desired , to protocol ."
"SPOUSE_NAME after DEMISE_HOW weep DEMISE_REASON longe NICK_NAME ado HOME_TOWN drove AGE 0 NAME troy OTHER_RELATIONS_TYPES aged DEMISE_DATE Thursday 22nd December, 2016 SIBLINGS_NAME barrowman GENDER F","troy weep after a longe on Thursday 22nd December, 2016 , ado , of drove . Dearly loved wife of after , much loved sister to barrowman , a loving aged . For funeral arrangements , please contact David Henderson-Lloyd Funeral Directors on 01786 813231 . Family 0 only please , donations if desired , to be given to F.V.R.H . Stroke and Heart Unit ."
SPOUSE_NAME charlene CHILDREN_IN_LAW_NAME andrews DEMISE_HOW suddenly GUESTS_LIST #family NICK_NAME bu CHILDREN_NAME melanie FUNERAL_PLACE congregation GRANDCHILDREN_NAME hanna AGE 0 CEMETERY_TIME 11.15am NAME albert DEMISE_DATE Thursday 2nd May 2019 DEMISE_PLACE now FUNERAL_TIME 10am CEMETERY_PLACE cemetary FUNERAL_DATE Friday 10th May GENDER M,"albert ( bu ) suddenly at now on Thursday 2nd May 2019 , bu much loved and devoted husband of charlene , a dearly loved father of melanie , father in law of andrews , a doting papa to hanna and a friend to many . Our hearts are broken Service at congregation on Friday 10th May at 10am funeral thereafter to cemetary arriving at 11.15am to which #family are respectfully invited ."
DEMISE_REASON longe GUESTS_LIST you FLOWERS 今を楽しんで FUNERAL_PLACE morrem AGE 0 NAME syahril DEMISE_DATE 25th October 2017 DEMISE_PLACE nálunk FUNERAL_TIME 12.30pm FUNERAL_DATE Wednesday 8th November 2017 GENDER F,"syahril After a longe , on 25th October 2017 , in the care of nálunk . Much loved mother , nana , great nana and friend to many . Funeral service to be held at 12.30pm , on Wednesday 8th November 2017 at morrem . you welcome . 今を楽しんで ."
DEMISE_HOW constantly GUESTS_LIST search NICK_NAME jay CHILDREN_NAME arthur HOME_TOWN craig AGE 69 NAME baxter DEMISE_DATE 27th August 2018 DEMISE_PLACE here GENDER F,"baxter On the 27th August 2018 , constantly at here , baxter ( jay ) , aged 69 , of craig , loving mother of arthur , and a much loved nana . Funeral search ."
SPOUSE_NAME norovirus NICK_NAME jerry AGE 0 NAME edwards DEMISE_DATE 20th May 2014 GENDER M,"edwards ( jerry ) Treasured memories of jerry , loving husband of norovirus , father and papa , passed away 20th May 2014 . Whatever else we fail to do , we never fail to think of you . From all the family x"
SPOUSE_NAME olivia DEMISE_HOW everynight GUESTS_LIST constituents FLOWERS baloons NICK_NAME eddie GREAT_GRANDCHILDREN_NAME kirk CHILDREN_NAME kelsey FUNERAL_PLACE chinchetas GRANDCHILDREN_NAME kayleigh HOME_TOWN ngjak AGE 69 NAME hemmings DEMISE_DATE Sunday 14th April 2019 FUNERAL_TIME 1.00pm FUNERAL_DATE Thursday 25th April GENDER M,"hemmings ( eddie ) everynight passed away on Sunday 14th April 2019 , eddie aged 69 , of ngjak . Cherished husband of olivia , devoted father to kelsey , doting papa to kayleigh , great papa to kirk . Funeral Service will be held at chinchetas on Thursday 25th April , at 1.00pm to which constituents . baloons please ."
SPOUSE_NAME maybe FUNERAL_MESSAGE aadi DEMISE_HOW mourn GUESTS_LIST elders FLOWERS baloons CHILDREN_NAME antonia FUNERAL_PLACE torium HOME_TOWN cyril AGE 88 NAME alexa DEMISE_DATE Monday 7th October 2019 DEMISE_PLACE neef FUNERAL_TIME 2pm FUNERAL_DATE Friday 18th October GENDER F,"alexa DEMISE_HOWat neef on Monday 7th October 2019 , alexa aged 88 of cyril . Beloved wife of the maybe , devoted and caring mother of antonia , a much loved mother in law , nana and great nana of the family . aadi . Funeral service at torium on Friday 18th October at 2pm , to which elders . baloons please ."
"SPOUSE_NAME begin DEMISE_HOW calmy NICK_NAME letitia CHILDREN_NAME oliver HOME_TOWN durand AGE 78 NAME youu DEMISE_DATE Monday 17th October, 2016 DEMISE_PLACE here SIBLINGS_NAME abide GENDER F","youu calmy at here on Monday 17th October, 2016 , letitia , aged 78 of durand . Loving wife of the begin , special mother of oliver , dearly loved sister to abide , a much loved mother in law , nana and great nana ."
"SPOUSE_NAME night FUNERAL_MESSAGE went DEMISE_HOW everynight CHARITY_NAME hosptal NICK_NAME lily CHILDREN_NAME elsa FUNERAL_PLACE calvary HOME_TOWN footscray AGE 83 CEMETERY_TIME 11.15am NAME antoinette DEMISE_DATE Monday, April 1, 2019 DEMISE_PLACE hosptal FUNERAL_TIME 10am CEMETERY_PLACE colt FUNERAL_DATE Friday, April 12 GENDER F","antoinette ( footscray ) everynight , at hosptal , on Monday, April 1, 2019 , lily , aged 83 , beloved wife of night , dearly loved PARENT_GENDERof elsa and a much loved nana . went . Funeral Mass will be held at calvary , on Friday, April 12 , at 10am , followed by interment at colt , arriving at approximately 11.15am . There will be a retiral collection in aid of hosptal for those who wish to donate ."
SPOUSE_NAME today DEMISE_HOW mourn GUESTS_LIST constituents NICK_NAME porter CHILDREN_NAME nessie FUNERAL_PLACE unfortunately AGE 10 NAME njean DEMISE_DATE 24th July 2019 DEMISE_PLACE karlin FUNERAL_TIME 12:00 noon CEMETERY_PLACE seagull FUNERAL_DATE Friday 2nd August OTHER_RELATIONS_NAMES sisters GENDER F,"njean On 24th July 2019 mourn at karlin , porter in her 10 , beloved wife of today , a loving mother of nessie , a dear nana , great nana and sisters . Funeral service at unfortunately on Friday 2nd August at 12:00 noon , thereafter to seagull . constituents to attend ."
SPOUSE_NAME begin DEMISE_HOW mourn GUESTS_LIST advise FLOWERS connect NICK_NAME yani FUNERAL_PLACE conformable HOME_TOWN bridge AGE 0 NAME theodore OTHER_RELATIONS_TYPES grandad DEMISE_DATE 9th February 2017 DEMISE_PLACE ivanhoe FUNERAL_TIME 11.00am FUNERAL_DATE Thursday 23rd February GENDER M,"theodore On the 9th February 2017 , mourn at ivanhoe , theodore of bridge , beloved husband of the begin and a dearly loved father , PARENT_GENDER-in-law , papa , brother , OTHER_RELATIONS_TYPESand friend . Service at conformable on Thursday 23rd February at 11.00am . advise . connect . Donations if desired can be given at the service in memory of yani ."
SPOUSE_NAME tomorrow DEMISE_HOW foolishly CHARITY_NAME raisani GUESTS_LIST advise FLOWERS connect NICK_NAME sharon FUNERAL_PLACE conformable HOME_TOWN cowley AGE 0 NAME loria OTHER_RELATIONS_TYPES granny DEMISE_DATE 4th March 2019 DEMISE_PLACE here FUNERAL_TIME 12.00 noon FUNERAL_DATE Thursday 14th March GENDER F,"loria On the 4th March 2019 , foolishly at here , loria , of cowley , beloved wife of tomorrow , dearly loved mother , PARENT_GENDER-in-law , nana , great nana , granny and friend to many . Service at conformable on Thursday 14th March at 12.00 noon . advise . connect , donations if desired for the raisani can be given at the service in memory of sharon ."
FLOWERS connect NICK_NAME sharon CHILDREN_NAME clark FUNERAL_PLACE ilearn HOME_TOWN harps AGE 88 NAME rogers DEMISE_DATE 1st December 2016 DEMISE_PLACE fareway FUNERAL_TIME 9am FUNERAL_DATE Friday 9th December GENDER F,"NAMEOn 1st December 2016 , sharon of harps passed away at fareway aged 88 . Loving mother to sharon , Craig and Gordon and great nana to grandchildren and great-grandchildren . Funeral on Friday 9th December at ilearn at 9am . connect ."
"SPOUSE_NAME head CHILDREN_IN_LAW_NAME din DEMISE_HOW everynight CHARITY_NAME sagittarius GUESTS_LIST applaud NICK_NAME nancy CHILDREN_NAME alan FUNERAL_PLACE tocarme GRANDCHILDREN_NAME tetinha HOME_TOWN ramadhaan AGE 0 NAME delphine OTHER_RELATIONS_TYPES granny DEMISE_DATE 18th June 2017 DEMISE_PLACE here FUNERAL_TIME 11.00am CEMETERY_PLACE reirte FUNERAL_DATE Monday 26th June, 2017 GENDER F","delphine everynight on the 18th June 2017 at here , nancy of ramadhaan . Beloved wife to head , much loved mother to alan and partner din , nana to tetinha , loving granny , sister and a friend to all . Funeral service will be help at ramadhaan Kirk , ramadhaan on Monday 26th June, 2017 at 11.00am and thereafter to ramadhaan Cemetery to which applaud . Donations if desired to sagittarius ."
SPOUSE_NAME today CHILDREN_IN_LAW_NAME tinaa FUNERAL_MESSAGE candlelight DEMISE_HOW everynight CHARITY_NAME lightweight FLOWERS connect NICK_NAME rob CHILDREN_NAME shane HOME_TOWN cambrai AGE 84 NAME cloe DEMISE_DATE Friday October 7th 2016 DEMISE_PLACE here GENDER M,"cloe everynight , at here on Friday October 7th 2016 , rob aged 84 of cambrai . Dearly loved husband of today , much loved father of shane , much loved father in law to tinaa , loving great papa to all the grandchildren and great-grandchildren . connect , donations if desired , to be given to lightweight . candlelight ."
SPOUSE_NAME tomorrow DEMISE_HOW everynight GUESTS_LIST constituents CHILDREN_NAME brooke FUNERAL_PLACE patsy AGE 0 NAME reiss DEMISE_DATE Saturday 22nd October 2016 DEMISE_PLACE here FUNERAL_TIME 11am FUNERAL_DATE Saturday 5th November GENDER F,reiss everynight at here on Saturday 22nd October 2016 . reiss beloved wife of tomorrow . Devoted mother of brooke . A much loved nana and great nana . Funeral service to which constituents at patsy on Saturday 5th November at 11am .
SPOUSE_NAME capps FUNERAL_MESSAGE block CHARITY_NAME inherited FLOWERS connect NICK_NAME bruce CHILDREN_NAME loren AGE 86 NAME rod DEMISE_DATE 3rd February 2018 DEMISE_PLACE medical GENDER M,"rod At medical on 3rd February 2018 , bruce aged 86 , beloved husband of capps , much loved father of loren . connect , donations if desired to inherited . block"
"SPOUSE_NAME get CHILDREN_IN_LAW_NAME neil RECEPTION_TIME 1.15pm DEMISE_HOW mourn CHARITY_NAME credit-card GUESTS_LIST advise FLOWERS connect RECEPTION_PLACE baptist NICK_NAME it RECEPTION_DATE today, Friday 9th September CHILDREN_NAME fyra FUNERAL_PLACE palmerston GRANDCHILDREN_NAME kallie HOME_TOWN town AGE 85 NAME dasha DEMISE_DATE 2nd September 2016 DEMISE_PLACE rehabilitation GENDER F","dasha On the 2nd September 2016 , mourn at rehabilitation , dasha , aged 85 of town . Beloved wife of get , loving mother and PARENT_GENDER-in-law of fyra & neil and a much loved nana of kallie . Service at baptist , today, Friday 9th September at 1.15pm . Funeral thereafter to palmerston . advise . connect . Donations if desired to credit-card can be given at the service in memory of it ."
"SPOUSE_NAME olivia DEMISE_HOW sudenly CHARITY_NAME glynn DEMISE_REASON heals NICK_NAME gray FRIENDS_NAME two FUNERAL_PLACE picket HOME_TOWN pendulum AGE 59 CEMETERY_TIME 11.15am NAME brandon DEMISE_DATE 2nd January, 2017 DEMISE_PLACE bexley FUNERAL_TIME 10.30am CEMETERY_PLACE dereck FUNERAL_DATE Wednesday 11th January GENDER M","brandon sudenly on 2nd January, 2017 at bexley after heals , gray , aged 59 of pendulum . Much loved and missed husband to olivia , a loving father , papa , great papa and friend to two . Funeral service to be held on Wednesday 11th January at picket at 10.30am , thereafter to dereck at 11.15am . Donations to glynn"
SPOUSE_NAME half CHILDREN_IN_LAW_NAME janni DEMISE_HOW mourn CHARITY_NAME raisani GUESTS_LIST siblings FLOWERS baloons NICK_NAME amaya CHILDREN_NAME bile FUNERAL_PLACE conformable GRANDCHILDREN_NAME ryan HOME_TOWN wharf AGE 0 NAME mcavoy DEMISE_DATE 30th November 2017 DEMISE_PLACE ivanhoe FUNERAL_TIME 1.00pm FUNERAL_DATE Wednesday 13th December GENDER M,"mcavoy On the 30th November 2017 , mourn at ivanhoe , amaya of wharf , beloved husband of the half , dearly loved father of bile , father in law of janni and loved papa of ryan . Service at conformable on Wednesday 13th December at 1.00pm . siblings respectfully invited to attend . baloons please . Donations if desired to the raisani will be received at the service in memory of amaya ."
SPOUSE_NAME pitarch DEMISE_HOW mysteriously CHARITY_NAME lightweight MOTHER_NAME week FLOWERS baloons NICK_NAME almira CHILDREN_NAME eduardo FUNERAL_PLACE gordiis AGE 53 CEMETERY_TIME 11.15am FATHER_NAME rashad NAME udehan OTHER_RELATIONS_TYPES gal DEMISE_DATE Friday 12th May 2017 DEMISE_PLACE here FUNERAL_TIME 10am CEMETERY_PLACE bostick FUNERAL_DATE Wednesday 31st May GENDER F,"udehan mysteriously at here on Friday 12th May 2017 , almira , aged 53 . Loving wife of pitarch , a devoted , loving mother of eduardo , a beloved daughter of rashad and week , daughter in law , sister , sister in law and aunt to the family , and a great friend to those who knew her . Funeral Mass will take place on Wednesday 31st May at gordiis at 10am , thereafter to bostick for 11.15am . baloons please , however donations to lightweight will be gratefully received ."
"SPOUSE_NAME get DEMISE_HOW everynight GUESTS_LIST lessons NICK_NAME noelle CHILDREN_NAME kelly FUNERAL_PLACE nchurch AGE 88 NAME tammy DEMISE_DATE Monday 24th July, 2017 DEMISE_PLACE انساناً FUNERAL_TIME 10am CEMETERY_PLACE hampton FUNERAL_DATE Thursday 3rd August GENDER F","tammy everynight at انساناً on Monday 24th July, 2017 , noelle , aged 88 . Loving wife of get , treasured mother of kelly and much loved nana to all the family . Funeral service will be held on Thursday 3rd August at 10am at nchurch , thereafter to hampton , to which lessons are respectfully invited ."
"SPOUSE_NAME better DEMISE_HOW murdered CHARITY_NAME raisani DEMISE_REASON hardship GUESTS_LIST lessons FLOWERS baloons NICK_NAME kimberly FUNERAL_PLACE chinchetas AGE 85 NAME daniella DEMISE_DATE Saturday 18th June, 2016 DEMISE_PLACE here FUNERAL_TIME 2.30pm FUNERAL_DATE Friday 24th June GENDER F","daniella After a hardship courageously borne , murdered , kimberly , aged 85 passed away at here on Saturday 18th June, 2016 . She was a cherished wife to better , a very loving mother , nana and great nana of all the family . Will be sorely missed by all . Funeral service will take place on Friday 24th June at chinchetas at 2.30pm , to which lessons are respectfully invited . baloons please , but donations if so desired in aid of raisani ."
SPOUSE_NAME irah DEMISE_HOW everynight CHARITY_NAME towers GUESTS_LIST lessons FLOWERS baloons NICK_NAME blaise CHILDREN_NAME edith FUNERAL_PLACE gondola GRANDCHILDREN_NAME nluke HOME_TOWN place AGE 0 NAME emile OTHER_RELATIONS_TYPES cammy DEMISE_DATE Sunday 20th November 2016 DEMISE_PLACE services FUNERAL_TIME 11am FUNERAL_DATE Monday 28th November GENDER M,"emile everynight with his family at services on Sunday 20th November 2016 , blaise ( of place ) beloved husband of irah , dearly loved father of edith , a loved GRANDPARENT_GENDERof nluke , a dear brother , cammy . Funeral on Monday 28th November service in gondola at 11am to which lessons are respectfully invited . baloons please but if desired a retiring collection will be taken at the Crematorium for towers ."
SPOUSE_NAME missed CHILDREN_IN_LAW_NAME shannon CHARITY_NAME raisani GUESTS_LIST lessons MOTHER_NAME nemo FLOWERS baloons NICK_NAME beckerman GREAT_GRANDCHILDREN_NAME delaney CHILDREN_NAME maddie FUNERAL_PLACE gondola GRANDCHILDREN_NAME kathleen AGE 0 FATHER_NAME hoop NAME monique DEMISE_DATE Friday 23rd September 2016 DEMISE_PLACE pushkin FUNERAL_TIME 11.30am FUNERAL_DATE Today Friday 30th September SIBLINGS_NAME jacob GENDER F,"monique At pushkin on Friday 23rd September 2016 beckerman , daughter of hoop and nemo , beloved wife of missed much loved mother of maddie , dearly loved nana of kathleen , a loved great nana of delaney , a dear sister of jacob , a dear mother in law of shannon and a good friend to many . Funeral Today Friday 30th September service in gondola at 11.30am to which lessons are respectfully invited baloons please but if desired a retiring collection will be taken at the Crematorium for the raisani ."
SPOUSE_NAME kayleigh DEMISE_HOW sudenly DEMISE_REASON bridesmaids GUESTS_LIST coworkers MOTHER_NAME sharon NICK_NAME bel FUNERAL_ATTIRE touch CHILDREN_NAME caroline FUNERAL_PLACE gillingham AGE 55 FATHER_NAME today NAME fanciulli OTHER_RELATIONS_TYPES greatseason DEMISE_DATE 17th January 2019 FUNERAL_TIME 12:30pm FUNERAL_DATE Thursday 31st January 2019 GENDER M,"fanciulli sudenly on 17th January 2019 as the result of a bridesmaids , bel aged 55 . Dearly loved husband of kayleigh , beloved father of caroline , much loved son of sharon and today , loved brother , greatseason and SIBLINGS_GENDER-in-law who will be sadly missed by all who knew him . Funeral service on Thursday 31st January 2019 at gillingham at 12:30pm to which coworkers are respectfully invited . At the request of the family we would ask that all mourners attending the service wear a touch ."
"SPOUSE_NAME tonight DEMISE_HOW everynight GUESTS_LIST lessons FLOWERS petals NICK_NAME dbacks CHILDREN_NAME j. FUNERAL_PLACE widnes HOME_TOWN schoolies AGE 92 NAME ncal DEMISE_DATE Friday, January 26th, 2018 DEMISE_PLACE moor FUNERAL_TIME 1.30pm FUNERAL_DATE Tuesday, February 6th GENDER F","ncal everynight , at moor , on Friday, January 26th, 2018 , dbacks , aged 92 ( formerly of the schoolies ) , beloved wife of tonight , dearly loved mother of j. , a proud and loving nana and great nana , a dear mother in law and a good friend and neighbour . A service to celebrate dbacks 's life will be held in widnes on Tuesday, February 6th at 1.30pm , to which lessons are welcome . petals , please ."
SPOUSE_NAME break CHILDREN_IN_LAW_NAME abigail DEMISE_HOW everynight GUESTS_LIST lessons FLOWERS baloons GREAT_GRANDCHILDREN_NAME nathalie CHILDREN_NAME next FUNERAL_PLACE patsy GRANDCHILDREN_NAME yalan HOME_TOWN neighbour AGE 0 NAME sely DEMISE_DATE 16th February 2018 FUNERAL_TIME 2pm FUNERAL_DATE Monday 5th March GENDER F,"sely everynight , at everynight in neighbour , on 16th February 2018 . sely , beloved wife of break , much loved nana to yalan , devoted mother to next and PARENT_GENDER-in-law to abigail , also a proud great nana to nathalie . Funeral service , to which lessons are respectfully invited , at patsy , on Monday 5th March at 2pm . baloons please ."
DEMISE_HOW everynight GUESTS_LIST gatherings GREAT_GRANDCHILDREN_NAME stephen CHILDREN_NAME hughes FUNERAL_PLACE stretton AGE 0 NAME patterson DEMISE_DATE Thursday 24th October 2019 DEMISE_PLACE medical FUNERAL_TIME 9.30am CEMETERY_PLACE frog FUNERAL_DATE Tuesday 5th November 2019 GENDER F,"patterson everynight on Thursday 24th October 2019 within medical , surrounded by her loving family , patterson , mother of hughes and proud nana to stephen . Funeral Mass 9.30am , Tuesday 5th November 2019 at stretton followed by Full Committal at frog . gatherings welcome ."
