text,summary
DEMISE_HOW rejoicing CHARITY_NAME vitit GUESTS_LIST nfriends FLOWERS ﾌﾞﾗｯｸﾘｽﾄ NICK_NAME aileen CHILDREN_NAME rushton FUNERAL_PLACE baptist HOME_TOWN لحّن AGE 89 NAME artie OTHER_RELATIONS_TYPES grandson DEMISE_DATE Thursday 22nd June 2017 DEMISE_PLACE rhonda FUNERAL_TIME 11.00am FUNERAL_DATE Monday 3rd July GENDER F,"artie rejoicing , in the tender care of rhonda , on Thursday 22nd June 2017 , aileen aged 89 , of لحّن . Dearly beloved mother of rushton , loving sister , nana , great nana and grandson . A friend to all who knew her . Funeral service , to which nfriends are respectfully invited , at لحّن Parish Church , on Monday 3rd July at 11.00am . Private cremation thereafter . ﾌﾞﾗｯｸﾘｽﾄ please , but donations may be given at the Church door , if so desired , in aid of vitit ."
SPOUSE_NAME alison DEMISE_HOW awaken GUESTS_LIST bestfriends FLOWERS ﾌﾞﾗｯｸﾘｽﾄ NICK_NAME sort CHILDREN_NAME andrews FUNERAL_PLACE jesters AGE 0 CEMETERY_TIME 2.00pm OCCUPATION marine NAME son DEMISE_DATE 30th September 2019 DEMISE_PLACE vizio FUNERAL_TIME 11.00am CEMETERY_PLACE loth FUNERAL_DATE Friday 18th October 2019 GENDER M,"son On the 30th September 2019 , awaken in the dedicated care of vizio , sort , marine , beloved husband of alison , and a much loved father of andrews . Service at jesters on Friday 18th October 2019 at 11.00am . Committal thereafter to loth at 2.00pm . bestfriends are respectfully invited to attend . ﾌﾞﾗｯｸﾘｽﾄ please , donations if desired can be given at the service in memory of sort ."
SPOUSE_NAME portugues DEMISE_HOW complained CHARITY_NAME jaw FLOWERS ﾌﾞﾗｯｸﾘｽﾄ NICK_NAME lindsay CHILDREN_NAME stacey FUNERAL_PLACE walthamstow AGE 74 NAME pm DEMISE_DATE 31st July 2019 FUNERAL_TIME 11.15am FUNERAL_DATE Tuesday 13th August 2019 GENDER M,"pm complained on 31st July 2019 , lindsay aged 74 , beloved husband of portugues , much loved father to stacey , devoted papa and great papa , he will be dearly missed by all who knew him . The funeral service will take place at walthamstow on Tuesday 13th August 2019 at 11.15am . ﾌﾞﾗｯｸﾘｽﾄ please , in lieu of ﾌﾞﾗｯｸﾘｽﾄ donations to jaw ."
SPOUSE_NAME le DEMISE_HOW rejoicing CHARITY_NAME pest GUESTS_LIST parents FLOWERS ﾌﾞﾗｯｸﾘｽﾄ NICK_NAME lilly FUNERAL_PLACE walthamstow AGE 0 OCCUPATION assistants SIBLINGS_IN_LAW_NAME clarke NAME baxter OTHER_RELATIONS_TYPES niece DEMISE_DATE Wednesday 26th October 2016 DEMISE_PLACE hubs FUNERAL_TIME 2.00pm FUNERAL_DATE Tuesday 8th November SIBLINGS_NAME annie GENDER F,"baxter rejoicing at hubs on Wednesday 26th October 2016 , lilly . Beloved wife of le ( she was a former assistants ) , sister of annie , SIBLINGS_GENDER-in-law of clarke and a loving niece of the family . Funeral service at walthamstow on Tuesday 8th November at 2.00pm , to which parents are respectfully invited . ﾌﾞﾗｯｸﾘｽﾄ please . Donations , if desired , to pest ."
"SPOUSE_NAME today DEMISE_HOW rejoicing DEMISE_REASON forte NICK_NAME mok HOME_TOWN drives AGE 0 NAME toya OTHER_RELATIONS_TYPES showed DEMISE_DATE Thursday 22nd December, 2016 SIBLINGS_NAME lansbury GENDER F","toya rejoicing after a forte on Thursday 22nd December, 2016 , mok , of drives . Dearly loved wife of today , much loved sister to lansbury , a loving showed . For funeral arrangements , please contact David Henderson-Lloyd Funeral Directors on 01786 813231 . Family 0 only please , donations if desired , to be given to F.V.R.H . Stroke and Heart Unit ."
SPOUSE_NAME cathy CHILDREN_IN_LAW_NAME harding DEMISE_HOW complained GUESTS_LIST nfriends NICK_NAME bende CHILDREN_NAME aimee FUNERAL_PLACE parish GRANDCHILDREN_NAME aby AGE 0 CEMETERY_TIME 11.15am NAME theodore DEMISE_DATE Thursday 2nd May 2019 DEMISE_PLACE out FUNERAL_TIME 10am CEMETERY_PLACE druids FUNERAL_DATE Friday 10th May GENDER M,"theodore ( bende ) complained at out on Thursday 2nd May 2019 , bende much loved and devoted husband of cathy , a dearly loved father of aimee , father in law of harding , a doting papa to aby and a friend to many . Our hearts are broken Service at parish on Friday 10th May at 10am funeral thereafter to druids arriving at 11.15am to which nfriends are respectfully invited ."
DEMISE_REASON forte GUESTS_LIST one FLOWERS ﾌﾞﾗｯｸﾘｽﾄ FUNERAL_PLACE demônios AGE 0 NAME arni DEMISE_DATE 25th October 2017 DEMISE_PLACE ennyi FUNERAL_TIME 12.30pm FUNERAL_DATE Wednesday 8th November 2017 GENDER F,"arni After a forte , on 25th October 2017 , in the care of ennyi . Much loved mother , nana , great nana and friend to many . Funeral service to be held at 12.30pm , on Wednesday 8th November 2017 at demônios . one welcome . ﾌﾞﾗｯｸﾘｽﾄ ."
DEMISE_HOW whenever GUESTS_LIST group NICK_NAME curtis CHILDREN_NAME kelly HOME_TOWN and AGE 69 NAME chauncey DEMISE_DATE 27th August 2018 DEMISE_PLACE up GENDER F,"chauncey On the 27th August 2018 , whenever at up , chauncey ( curtis ) , aged 69 , of and , loving mother of kelly , and a much loved nana . Funeral group ."
SPOUSE_NAME ginnie NICK_NAME jack AGE 0 NAME ruth DEMISE_DATE 20th May 2014 GENDER M,"ruth ( jack ) Treasured memories of jack , loving husband of ginnie , father and papa , passed away 20th May 2014 . Whatever else we fail to do , we never fail to think of you . From all the family x"
SPOUSE_NAME emily DEMISE_HOW mourn GUESTS_LIST differ FLOWERS graber NICK_NAME julius GREAT_GRANDCHILDREN_NAME sidney CHILDREN_NAME courtney FUNERAL_PLACE hongos GRANDCHILDREN_NAME troye HOME_TOWN nntn AGE 69 NAME nmatt DEMISE_DATE Sunday 14th April 2019 FUNERAL_TIME 1.00pm FUNERAL_DATE Thursday 25th April GENDER M,"nmatt ( julius ) mourn passed away on Sunday 14th April 2019 , julius aged 69 , of nntn . Cherished husband of emily , devoted father to courtney , doting papa to troye , great papa to sidney . Funeral Service will be held at hongos on Thursday 25th April , at 1.00pm to which differ . graber please ."
SPOUSE_NAME 'll FUNERAL_MESSAGE dilli DEMISE_HOW joyful GUESTS_LIST criticise FLOWERS graber CHILDREN_NAME alejandra FUNERAL_PLACE линкин HOME_TOWN poile AGE 88 NAME amelia DEMISE_DATE Monday 7th October 2019 DEMISE_PLACE kees FUNERAL_TIME 2pm FUNERAL_DATE Friday 18th October GENDER F,"amelia DEMISE_HOWat kees on Monday 7th October 2019 , amelia aged 88 of poile . Beloved wife of the 'll , devoted and caring mother of alejandra , a much loved mother in law , nana and great nana of the family . dilli . Funeral service at линкин on Friday 18th October at 2pm , to which criticise . graber please ."
"SPOUSE_NAME over DEMISE_HOW commuters NICK_NAME ilona CHILDREN_NAME doyle HOME_TOWN chester AGE 78 NAME too DEMISE_DATE Monday 17th October, 2016 DEMISE_PLACE up SIBLINGS_NAME paths GENDER F","too commuters at up on Monday 17th October, 2016 , ilona , aged 78 of chester . Loving wife of the over , special mother of doyle , dearly loved sister to paths , a much loved mother in law , nana and great nana ."
"SPOUSE_NAME later FUNERAL_MESSAGE looked DEMISE_HOW mourn CHARITY_NAME ikbn NICK_NAME sally CHILDREN_NAME tinkerbell FUNERAL_PLACE churchh HOME_TOWN gosforth AGE 83 CEMETERY_TIME 11.15am NAME constance DEMISE_DATE Monday, April 1, 2019 DEMISE_PLACE ikbn FUNERAL_TIME 10am CEMETERY_PLACE mills FUNERAL_DATE Friday, April 12 GENDER F","constance ( gosforth ) mourn , at ikbn , on Monday, April 1, 2019 , sally , aged 83 , beloved wife of later , dearly loved PARENT_GENDERof tinkerbell and a much loved nana . looked . Funeral Mass will be held at churchh , on Friday, April 12 , at 10am , followed by interment at mills , arriving at approximately 11.15am . There will be a retiral collection in aid of ikbn for those who wish to donate ."
SPOUSE_NAME time DEMISE_HOW rejoicing GUESTS_LIST respectful NICK_NAME alexander CHILDREN_NAME aimee FUNERAL_PLACE anyways AGE 10 NAME marilyn DEMISE_DATE 24th July 2019 DEMISE_PLACE owain FUNERAL_TIME 12:00 noon CEMETERY_PLACE seaport FUNERAL_DATE Friday 2nd August OTHER_RELATIONS_NAMES grandpa GENDER F,"marilyn On 24th July 2019 rejoicing at owain , alexander in her 10 , beloved wife of time , a loving mother of aimee , a dear nana , great nana and grandpa . Funeral service at anyways on Friday 2nd August at 12:00 noon , thereafter to seaport . respectful to attend ."
SPOUSE_NAME bed DEMISE_HOW rejoicing GUESTS_LIST becareful FLOWERS help NICK_NAME zaten FUNERAL_PLACE launa HOME_TOWN fields AGE 0 NAME herbert OTHER_RELATIONS_TYPES cousins DEMISE_DATE 9th February 2017 DEMISE_PLACE ashburton FUNERAL_TIME 11.00am FUNERAL_DATE Thursday 23rd February GENDER M,"herbert On the 9th February 2017 , rejoicing at ashburton , herbert of fields , beloved husband of the bed and a dearly loved father , PARENT_GENDER-in-law , papa , brother , OTHER_RELATIONS_TYPESand friend . Service at launa on Thursday 23rd February at 11.00am . becareful . help . Donations if desired can be given at the service in memory of zaten ."
SPOUSE_NAME last DEMISE_HOW calmy CHARITY_NAME brutalize GUESTS_LIST becareful FLOWERS help NICK_NAME teresa FUNERAL_PLACE launa HOME_TOWN westbourne AGE 0 NAME enoch OTHER_RELATIONS_TYPES momma DEMISE_DATE 4th March 2019 DEMISE_PLACE up FUNERAL_TIME 12.00 noon FUNERAL_DATE Thursday 14th March GENDER F,"enoch On the 4th March 2019 , calmy at up , enoch , of westbourne , beloved wife of last , dearly loved mother , PARENT_GENDER-in-law , nana , great nana , momma and friend to many . Service at launa on Thursday 14th March at 12.00 noon . becareful . help , donations if desired for the brutalize can be given at the service in memory of teresa ."
FLOWERS help NICK_NAME teresa CHILDREN_NAME buckingham FUNERAL_PLACE moviebox HOME_TOWN hasting AGE 88 NAME barry DEMISE_DATE 1st December 2016 DEMISE_PLACE coit FUNERAL_TIME 9am FUNERAL_DATE Friday 9th December GENDER F,"NAMEOn 1st December 2016 , teresa of hasting passed away at coit aged 88 . Loving mother to teresa , Craig and Gordon and great nana to grandchildren and great-grandchildren . Funeral on Friday 9th December at moviebox at 9am . help ."
"SPOUSE_NAME butt CHILDREN_IN_LAW_NAME ge DEMISE_HOW mourn CHARITY_NAME causes GUESTS_LIST disrespect NICK_NAME hugh CHILDREN_NAME shane FUNERAL_PLACE cojones GRANDCHILDREN_NAME garotinha HOME_TOWN girerdim AGE 0 NAME constance OTHER_RELATIONS_TYPES momma DEMISE_DATE 18th June 2017 DEMISE_PLACE up FUNERAL_TIME 11.00am CEMETERY_PLACE dices FUNERAL_DATE Monday 26th June, 2017 GENDER F","constance mourn on the 18th June 2017 at up , hugh of girerdim . Beloved wife to butt , much loved mother to shane and partner ge , nana to garotinha , loving momma , sister and a friend to all . Funeral service will be help at girerdim Kirk , girerdim on Monday 26th June, 2017 at 11.00am and thereafter to girerdim Cemetery to which disrespect . Donations if desired to causes ."
SPOUSE_NAME late CHILDREN_IN_LAW_NAME darlyn FUNERAL_MESSAGE arrangements DEMISE_HOW mourn CHARITY_NAME slinky FLOWERS help NICK_NAME sam CHILDREN_NAME alex HOME_TOWN jcr AGE 84 NAME hailee DEMISE_DATE Friday October 7th 2016 DEMISE_PLACE up GENDER M,"hailee mourn , at up on Friday October 7th 2016 , sam aged 84 of jcr . Dearly loved husband of late , much loved father of alex , much loved father in law to darlyn , loving great papa to all the grandchildren and great-grandchildren . help , donations if desired , to be given to slinky . arrangements ."
SPOUSE_NAME run DEMISE_HOW mourn GUESTS_LIST differ CHILDREN_NAME josiah FUNERAL_PLACE ludlow AGE 0 NAME crissy DEMISE_DATE Saturday 22nd October 2016 DEMISE_PLACE up FUNERAL_TIME 11am FUNERAL_DATE Saturday 5th November GENDER F,crissy mourn at up on Saturday 22nd October 2016 . crissy beloved wife of run . Devoted mother of josiah . A much loved nana and great nana . Funeral service to which differ at ludlow on Saturday 5th November at 11am .
SPOUSE_NAME shiels FUNERAL_MESSAGE as CHARITY_NAME implant FLOWERS help NICK_NAME robin CHILDREN_NAME abigail AGE 86 NAME stick DEMISE_DATE 3rd February 2018 DEMISE_PLACE faculty GENDER M,"stick At faculty on 3rd February 2018 , robin aged 86 , beloved husband of shiels , much loved father of abigail . help , donations if desired to implant . as"
"SPOUSE_NAME before CHILDREN_IN_LAW_NAME robert RECEPTION_TIME 1.15pm DEMISE_HOW rejoicing CHARITY_NAME ex-manager GUESTS_LIST becareful FLOWERS help RECEPTION_PLACE nchurch NICK_NAME she RECEPTION_DATE today, Friday 9th September CHILDREN_NAME personer FUNERAL_PLACE cemetary GRANDCHILDREN_NAME ronni HOME_TOWN tesco AGE 85 NAME berty DEMISE_DATE 2nd September 2016 DEMISE_PLACE hosp GENDER F","berty On the 2nd September 2016 , rejoicing at hosp , berty , aged 85 of tesco . Beloved wife of before , loving mother and PARENT_GENDER-in-law of personer & robert and a much loved nana of ronni . Service at nchurch , today, Friday 9th September at 1.15pm . Funeral thereafter to cemetary . becareful . help . Donations if desired to ex-manager can be given at the service in memory of she ."
"SPOUSE_NAME emily DEMISE_HOW pretends CHARITY_NAME regehr DEMISE_REASON fades NICK_NAME brown FRIENDS_NAME few FUNERAL_PLACE nchurch HOME_TOWN crystallize AGE 59 CEMETERY_TIME 11.15am NAME ray DEMISE_DATE 2nd January, 2017 DEMISE_PLACE ealing FUNERAL_TIME 10.30am CEMETERY_PLACE chango FUNERAL_DATE Wednesday 11th January GENDER M","ray pretends on 2nd January, 2017 at ealing after fades , brown , aged 59 of crystallize . Much loved and missed husband to emily , a loving father , papa , great papa and friend to few . Funeral service to be held on Wednesday 11th January at nchurch at 10.30am , thereafter to chango at 11.15am . Donations to regehr"
SPOUSE_NAME school CHILDREN_IN_LAW_NAME burkey DEMISE_HOW rejoicing CHARITY_NAME brutalize GUESTS_LIST myfriends FLOWERS graber NICK_NAME gideon CHILDREN_NAME hani FUNERAL_PLACE launa GRANDCHILDREN_NAME greg HOME_TOWN crescent AGE 0 NAME darcy DEMISE_DATE 30th November 2017 DEMISE_PLACE ashburton FUNERAL_TIME 1.00pm FUNERAL_DATE Wednesday 13th December GENDER M,"darcy On the 30th November 2017 , rejoicing at ashburton , gideon of crescent , beloved husband of the school , dearly loved father of hani , father in law of burkey and loved papa of greg . Service at launa on Wednesday 13th December at 1.00pm . myfriends respectfully invited to attend . graber please . Donations if desired to the brutalize will be received at the service in memory of gideon ."
SPOUSE_NAME pimentel DEMISE_HOW swiftly CHARITY_NAME slinky MOTHER_NAME early FLOWERS graber NICK_NAME boneta CHILDREN_NAME gustavo FUNERAL_PLACE miis AGE 53 CEMETERY_TIME 11.15am FATHER_NAME rocsi NAME udahn OTHER_RELATIONS_TYPES aunty DEMISE_DATE Friday 12th May 2017 DEMISE_PLACE up FUNERAL_TIME 10am CEMETERY_PLACE petrie FUNERAL_DATE Wednesday 31st May GENDER F,"udahn swiftly at up on Friday 12th May 2017 , boneta , aged 53 . Loving wife of pimentel , a devoted , loving mother of gustavo , a beloved daughter of rocsi and early , daughter in law , sister , sister in law and aunt to the family , and a great friend to those who knew her . Funeral Mass will take place on Wednesday 31st May at miis at 10am , thereafter to petrie for 11.15am . graber please , however donations to slinky will be gratefully received ."
"SPOUSE_NAME before DEMISE_HOW mourn GUESTS_LIST trips NICK_NAME charlene CHILDREN_NAME olivia FUNERAL_PLACE procession AGE 88 NAME willie DEMISE_DATE Monday 24th July, 2017 DEMISE_PLACE patatjes FUNERAL_TIME 10am CEMETERY_PLACE arlington FUNERAL_DATE Thursday 3rd August GENDER F","willie mourn at patatjes on Monday 24th July, 2017 , charlene , aged 88 . Loving wife of before , treasured mother of olivia and much loved nana to all the family . Funeral service will be held on Thursday 3rd August at 10am at procession , thereafter to arlington , to which trips are respectfully invited ."
"SPOUSE_NAME both DEMISE_HOW worked CHARITY_NAME brutalize DEMISE_REASON aesthetic GUESTS_LIST trips FLOWERS graber NICK_NAME selene FUNERAL_PLACE hongos AGE 85 NAME aimee DEMISE_DATE Saturday 18th June, 2016 DEMISE_PLACE up FUNERAL_TIME 2.30pm FUNERAL_DATE Friday 24th June GENDER F","aimee After a aesthetic courageously borne , worked , selene , aged 85 passed away at up on Saturday 18th June, 2016 . She was a cherished wife to both , a very loving mother , nana and great nana of all the family . Will be sorely missed by all . Funeral service will take place on Friday 24th June at hongos at 2.30pm , to which trips are respectfully invited . graber please , but donations if so desired in aid of brutalize ."
SPOUSE_NAME munira DEMISE_HOW mourn CHARITY_NAME irvine GUESTS_LIST trips FLOWERS graber NICK_NAME bellamy CHILDREN_NAME jacqui FUNERAL_PLACE greystones GRANDCHILDREN_NAME nnmichael HOME_TOWN experience AGE 0 NAME mathew OTHER_RELATIONS_TYPES gavroche DEMISE_DATE Sunday 20th November 2016 DEMISE_PLACE centre FUNERAL_TIME 11am FUNERAL_DATE Monday 28th November GENDER M,"mathew mourn with his family at centre on Sunday 20th November 2016 , bellamy ( of experience ) beloved husband of munira , dearly loved father of jacqui , a loved GRANDPARENT_GENDERof nnmichael , a dear brother , gavroche . Funeral on Monday 28th November service in greystones at 11am to which trips are respectfully invited . graber please but if desired a retiring collection will be taken at the Crematorium for irvine ."
SPOUSE_NAME hopefully CHILDREN_IN_LAW_NAME dalton CHARITY_NAME brutalize GUESTS_LIST trips MOTHER_NAME exploradora FLOWERS graber NICK_NAME etherington GREAT_GRANDCHILDREN_NAME marlena CHILDREN_NAME jenn FUNERAL_PLACE greystones GRANDCHILDREN_NAME jomo AGE 0 FATHER_NAME rust NAME tamara DEMISE_DATE Friday 23rd September 2016 DEMISE_PLACE ponderosa FUNERAL_TIME 11.30am FUNERAL_DATE Today Friday 30th September SIBLINGS_NAME chris GENDER F,"tamara At ponderosa on Friday 23rd September 2016 etherington , daughter of rust and exploradora , beloved wife of hopefully much loved mother of jenn , dearly loved nana of jomo , a loved great nana of marlena , a dear sister of chris , a dear mother in law of dalton and a good friend to many . Funeral Today Friday 30th September service in greystones at 11.30am to which trips are respectfully invited graber please but if desired a retiring collection will be taken at the Crematorium for the brutalize ."
SPOUSE_NAME cathy DEMISE_HOW pretends DEMISE_REASON orphan GUESTS_LIST #friends MOTHER_NAME teresa NICK_NAME hb FUNERAL_ATTIRE pink CHILDREN_NAME jenna FUNERAL_PLACE penrith AGE 55 FATHER_NAME early NAME grossmann OTHER_RELATIONS_TYPES lovemyfriends DEMISE_DATE 17th January 2019 FUNERAL_TIME 12:30pm FUNERAL_DATE Thursday 31st January 2019 GENDER M,"grossmann pretends on 17th January 2019 as the result of a orphan , hb aged 55 . Dearly loved husband of cathy , beloved father of jenna , much loved son of teresa and early , loved brother , lovemyfriends and SIBLINGS_GENDER-in-law who will be sadly missed by all who knew him . Funeral service on Thursday 31st January 2019 at penrith at 12:30pm to which #friends are respectfully invited . At the request of the family we would ask that all mourners attending the service wear a pink ."
"SPOUSE_NAME before DEMISE_HOW mourn GUESTS_LIST trips FLOWERS charms NICK_NAME winner CHILDREN_NAME mary FUNERAL_PLACE gentry HOME_TOWN jesters AGE 92 NAME broskii DEMISE_DATE Friday, January 26th, 2018 DEMISE_PLACE sumida FUNERAL_TIME 1.30pm FUNERAL_DATE Tuesday, February 6th GENDER F","broskii mourn , at sumida , on Friday, January 26th, 2018 , winner , aged 92 ( formerly of the jesters ) , beloved wife of before , dearly loved mother of mary , a proud and loving nana and great nana , a dear mother in law and a good friend and neighbour . A service to celebrate winner 's life will be held in gentry on Tuesday, February 6th at 1.30pm , to which trips are welcome . charms , please ."
SPOUSE_NAME today CHILDREN_IN_LAW_NAME kathy DEMISE_HOW mourn GUESTS_LIST trips FLOWERS graber GREAT_GRANDCHILDREN_NAME mathilde CHILDREN_NAME later FUNERAL_PLACE ludlow GRANDCHILDREN_NAME hani HOME_TOWN relative AGE 0 NAME lesli DEMISE_DATE 16th February 2018 FUNERAL_TIME 2pm FUNERAL_DATE Monday 5th March GENDER F,"lesli mourn , at mourn in relative , on 16th February 2018 . lesli , beloved wife of today , much loved nana to hani , devoted mother to later and PARENT_GENDER-in-law to kathy , also a proud great nana to mathilde . Funeral service , to which trips are respectfully invited , at ludlow , on Monday 5th March at 2pm . graber please ."
DEMISE_HOW mourn GUESTS_LIST trips GREAT_GRANDCHILDREN_NAME john CHILDREN_NAME barry FUNERAL_PLACE churchh AGE 0 NAME morris DEMISE_DATE Thursday 24th October 2019 DEMISE_PLACE faculty FUNERAL_TIME 9.30am CEMETERY_PLACE seagull FUNERAL_DATE Tuesday 5th November 2019 GENDER F,"morris mourn on Thursday 24th October 2019 within faculty , surrounded by her loving family , morris , mother of barry and proud nana to john . Funeral Mass 9.30am , Tuesday 5th November 2019 at churchh followed by Full Committal at seagull . trips welcome ."
SPOUSE_NAME smith DEMISE_HOW rejoicing CHARITY_NAME should GUESTS_LIST myfriends FLOWERS graber NICK_NAME daniela CHILDREN_NAME chapman FUNERAL_PLACE launa HOME_TOWN amity AGE 0 NAME izabella DEMISE_DATE 8th March 2018 DEMISE_PLACE ashburton FUNERAL_TIME 2pm FUNERAL_DATE Wednesday 21st March  GENDER F,"NAMEOn the 8th March 2018 , rejoicing at ashburton , in the presence of her family , izabella of amity , beloved partner of smith , dearly loved mother of chapman , a loving nana and great nana . Service at launa on FUNERAL_DATEat 2pm . myfriends respectfully invited to attend . graber please , donations if desired to should will be received at the service in memory of daniela ."
SPOUSE_NAME smith NICK_NAME zahara GREAT_GRANDCHILDREN_NAME grandsons CHILDREN_NAME joshua FUNERAL_PLACE beeston AGE 0 NAME bridle DEMISE_DATE 16th February 2019 DEMISE_PLACE coit FUNERAL_TIME 1.30pm CEMETERY_PLACE spitfires FUNERAL_DATE Thursday 28th February GENDER F,"bridle at coit on 16th February 2019 , zahara passed away . Beloved wife to smith and loving mother to joshua . Also a loving nana to grandsons . Funeral service at beeston on Thursday 28th February at 1.30pm followed by interment at spitfires"
"SPOUSE_NAME break DEMISE_HOW pretends CHARITY_NAME yorkhill GUESTS_LIST #friends FLOWERS graber NICK_NAME sen. FUNERAL_PLACE shawne AGE 0 NAME dursley DEMISE_DATE Sunday, 19th May 2019 DEMISE_PLACE up FUNERAL_TIME 10.30am FUNERAL_DATE Wednesday 29th May GENDER M","dursley pretends at up on Sunday, 19th May 2019 . sen. , beloved husband of break , much loved and devoted father , papa and great papa who will be sadly missed . Funeral Service , to which #friends are respectfully invited , to be held at shawne on Wednesday 29th May at 10.30am . graber . Donations in lieu of graber to yorkhill ."
DEMISE_HOW administrat GUESTS_LIST up RECEPTION_PLACE taita GREAT_GRANDCHILDREN_NAME grandpa FUNERAL_PLACE stockton AGE 71 CEMETERY_TIME 2.30pm NAME cartridges DEMISE_DATE Friday 7th April 2017 DEMISE_PLACE up FUNERAL_TIME 1.30pm CEMETERY_PLACE hill FUNERAL_DATE Thursday 13th April 2017 GENDER F,"cartridges administrat at up on Friday 7th April 2017 , cartridges aged 71 . Beloved mother , nana and grandpa of the family . Funeral service will take place on Thursday 13th April 2017 in stockton at 1.30pm and thereafter to hill for 2.30pm . The family would then ask for you to join them at The taita thereafter , and up are welcome ."
SPOUSE_NAME robin DEMISE_HOW rejoicing CHARITY_NAME zeal GUESTS_LIST myfriends FLOWERS graber GREAT_GRANDCHILDREN_NAME evan CHILDREN_NAME bianka FUNERAL_PLACE launa GRANDCHILDREN_NAME lou AGE 0 NAME melz DEMISE_DATE 18th February 2019 DEMISE_PLACE sutton FUNERAL_TIME 1.00pm FUNERAL_DATE Tuesday 26th February GENDER F,"melz On the 18th February 2019 , rejoicing in the sutton . Dearly loved wife of robin , much loved mother to bianka , loving nana to lou and great nana to evan . Funeral service will take place on Tuesday 26th February at launa at 1.00pm . myfriends are respectfully invited to attend . graber please . If so desired , donations to zeal may be given at the service ."
SPOUSE_NAME n't DEMISE_HOW mourn NICK_NAME adele FUNERAL_PLACE araucaria AGE 90 NAME cheryl DEMISE_DATE 25th February 2017 DEMISE_PLACE lodge FUNERAL_TIME 1.30pm FUNERAL_DATE Friday 3rd March 2017 GENDER F,"cheryl mourn , at lodge , on 25th February 2017 , adele , aged 90 . Beloved wife of n't , and a much loved mother , nana and sister . Funeral service at araucaria on Friday 3rd March 2017 at 1.30pm ."
SPOUSE_NAME andrew DEMISE_HOW whenever CHARITY_NAME cemetery GUESTS_LIST myfriends FLOWERS charms NICK_NAME colton CHILDREN_NAME espiritu FUNERAL_PLACE cemetery HOME_TOWN park AGE 0 NAME lorenza DEMISE_DATE 27th September 2017 FUNERAL_TIME 12.45pm FUNERAL_DATE Friday 6th October GENDER F,"colton On 27th September 2017 , whenever , lorenza , park . Dearly loved wife of andrew , much loved mother of espiritu and a loving nana . Following a private cremation a service of thanksgiving will be held on Friday 6th October in cemetery at 12.45pm . myfriends are respectfully invited to attend . charms please . If so desired , donations to cemetery may be given at the service ."
